{
  "schema": "inshell.thought.production-deployment-lock.v2",
  "revision": 1,
  "state": "no-approved-deployment",
  "requiredRelease": {
    "artifactId": "thought-v2-canonical-portable-release-20260807-r2",
    "manifestSha256": "7cf7965edb3de6421c79d9c08f0781cabb78ea675bad354847b56ec8f19306cc"
  },
  "deployment": null,
  "evidence": null,
  "review": {
    "reference": "docs/DEPLOYMENT_LOCK_RUNBOOK.md"
  }
}
